{
  "applicability": "declared domain and receiving-model limits",
  "conditions": {
    "composition": "project-specific",
    "pressure": "project-specific or not applicable",
    "temperature": "project-specific"
  },
  "model_uncertainty": {
    "basis": "synthetic placeholder; replace with measured project uncertainty before use",
    "unit": "1",
    "value": 0.0
  },
  "quantity": "quantity",
  "reference_state": "declared reference",
  "source_model": "source",
  "statistical_uncertainty": {
    "basis": "synthetic placeholder; replace with measured project uncertainty before use",
    "unit": "1",
    "value": 0.0
  },
  "target_model": "target",
  "transformation": "identity or explicit conversion formula",
  "unit": "1",
  "validation_status": "unvalidated",
  "value": 0.0
}
